{
  "toyType": "top",
  "experimentalEnabled": true,
  "outlineStyle": "flower",
  "outlineAmount": 80,
  "alienStyle": "eyePetals",
  "alienAmount": 50,
  "complexity": 65,
  "designSeed": 4837,
  "bodyTheme": "none",
  "themeAmount": 4,
  "themeSize": 4,
  "bodyDiameter": 60,
  "bodyHeight": 14,
  "stemHeight": 25,
  "stemDiameter": 9,
  "tipLength": 8,
  "rimStyle": "wavy",
  "rimPattern": "turbine",
  "rimSweep": 7,
  "armSpiral": 10,
  "armReach": 9,
  "bodyCrownStyle": "jewelled",
  "bodyCrownSize": 6,
  "bodyCrownHeight": 5,
  "bodyCrownLobes": 10,
  "bodyCrownTwist": 2,
  "handleStyle": "castle",
  "pommelStyle": "crystal",
  "hubStyle": "smooth",
  "hubHeight": 3,
  "hubDepth": 2,
  "hubLobes": 8,
  "hubTwist": 0,
  "lobes": 6,
  "waveDepth": 7,
  "rimLift": 3,
  "secondaryLobes": 12,
  "twist": 4,
  "handleTwist": 5,
  "handleFins": 4,
  "handleFlare": 4,
  "holes": 0,
  "holeSize": 3,
  "topperStyle": "none",
  "topperHeight": 24,
  "topperWidth": 18,
  "topperFeatures": 6,
  "topperTwist": 2,
  "topperRelief": 4,
  "color": "#8e6df2"
}